news_headline,news_article,news_category
Hong Kong sees first potential COVID-19 death in 5 months,"Hong Kong reported its first potential death linked to COVID-19 in five months as a 73-year-old man suffering from chronic illness died on Tuesday. The hospital authorities said the man had tested positive for COVID-19 in screening during his admission. The death, however, has not yet been officially classified as a COVID-19 casualty pending additional tests.",world
"Mudslide in Colombia kills at least 14, injures 35","At least 14 people were killed and 35 injured after heavy rains triggered a mudslide in Colombia's Risaralda province, said authorities. Several houses were reportedly buried in the incident. Pereira Mayor Carlos Maya urged the people to leave the area as the risk of landslides persisted. Over 60 houses were evacuated as the authorities carried out a damage assessment.",world
Police arrest 13 in Belgium during anti-terror operation,"The police in Belgium on Tuesday detained 13 people for alleged links to a terror group during raids in and around the port city of Antwerp. About 100 police officers were involved in the operation. The police operation was not aimed at stopping an imminent threat of attack, according to the federal prosecutor's office.",world
Year-long battle over Yemeni city left 1 lakh displaced: Oxfam report,"International Charity Group, Oxfam on Tuesday said a year-long battle over city of Marib in Yemen has displaced one lakh people. Oxfam said at least 43 airstrikes hit civilian targets including houses and farms in January. Land mines killed eight in January alone, Oxfam added. Marib has seen multiple attacks by Saudi-backed forces and Iran-backed Houthi rebels since last February.",world
UK to bring law mandating porn sites to verify users’ age,"The UK government is planning to make it mandatory for porn websites to verify users' age and ensure only those aged 18 or above can visit. It will be part of the Online Safety Bill which the government will bring in the coming months. The defaulters could be fined up to 10% of their annual sales, said the government.",world
Israel strikes Syria in response to anti-aircraft fire,"The Israel Defense Forces (IDF) ""struck surface-to-air missile targets in Syria, including radar & anti-aircraft batteries"" on Wednesday after an anti-aircraft missile was fired towards Israel. The anti-aircraft missile triggered sirens in parts of Israel and occupied West Bank, and exploded in mid-air, IDF added. Syrian state news agency SANA claimed Syrian forces shot down some Israeli missiles.",world
"Italy makes protecting environment, biodiversity part of Constitution","Italy passed a law making environment protection a part of the Constitution on Tuesday. According to the law, the state must safeguard the environment, biodiversity and the ecosystem in the interest of future generations. No economic initiative should be taken at the cost of the environment, as per the new law. The environmental activists reportedly welcomed the decision.",world
Truckers block busiest US-Canada land crossing in COVID-19 protest,"Canadian truckers on Monday blocked lanes on Ambassador Bridge, the busiest US-Canada land crossing, in protest against Canada’s COVID-19 vaccine mandate for cross-border traffic and restrictions. Truck drivers, part of the ""Freedom Convoy"" began protesting by blocking streets in Canada’s capital Ottawa, from January 28. Canada’s Border Services Agency said the bridge will remain shut on Tuesday. ",world
Will not abandon Palestinian support for closer ties with Israel: Turkey,"Turkish Foreign Minister Mevlüt Çavuşoğlu on Tuesday said that Turkey will not turn its back on its commitment to a Palestinian state in order to broker closer ties with Israel. Notably, the remark comes ahead of an expected visit by the Israeli President to Turkey in March. Turkey has condemned Israel's occupation of West Bank and its policy towards Palestinians.",world
Iran reports over 100 COVID-19 deaths in a day amid Omicron surge,"Iran on Monday reported 104 COVID-19 related deaths in the past 24 hours, as the Omicron variant continues to spread across the country. Iran's official death count now stands at 1,32,934, making it the country with the highest national death toll in the Middle East. Around 80% of people aged 18 and older are fully vaccinated. ",world
UN demands release of 4 Afghan women activists and their relatives,"The UN human rights office on Tuesday called for the immediate release of four women activists and their relatives who were detained or abducted in Afghanistan after last month's protest over women's rights. The women had reportedly taken part in the protest, it said. ""We're gravely concerned for the safety of the disappeared women and their family members,"" it added.",world
Biden will soon engage with French Prez Macron over Russia: US,"US President Joe Biden will ""soon"" engage with his French counterpart Emmanuel Macron over ""the possible threat of a Russian invasion into Ukraine"", White House Press Secretary Jen Psaki said. Macron this week met Russian President Vladimir Putin, becoming the first leader of a major Western power to meet him after Russia massed troops along its border with Ukraine. ",world
We're not looking to rename Taiwan's de facto embassy: Australia,"Australian Foreign Minister Marise Payne said that Australia is not looking at renaming Taiwan's de facto embassy in the country. ""Australia remains committed to our one-China policy,"" Payne added. The minister's comments come after China downgraded ties with Lithuania after it allowed Taiwan to open a Representative Office in the capital Vilnius bearing its own name instead of Chinese Taipei.",world
Malaysian COVID-19 panel recommends reopening borders in March,"Malaysia’s COVID-19 recovery council on Tuesday recommended reopening its borders for travellers without quarantine requirements from March 1 to boost economic recovery. Currently, a bilateral agreement with Singapore allows people to enter quarantine-free. Around 98% of Malaysia’s adult population is fully vaccinated, and 89% of 12 to 17-year-olds are also vaccinated.",world
UAE says new blast was gas explosion as US warns of possible drone strike,"A blast that took place in the UAE's capital Abu Dhabi early on Wednesday was due to a gas explosion, authorities said, as the US embassy issued a warning of ""reports of a possible missile or drone strike"". The embassy also warned American citizens to stay vigilant. Yemen's Houthi rebels have launched several attacks targeting Abu Dhabi in recent weeks. ",world
Talks to revive 2015 Iran nuclear deal resume in Vienna,"Talks between Iran and the world powers to revive the 2015 nuclear deal have resumed in Vienna, Austria after a 10-day break. Officials said that the talks are reaching their final stage, though it's unclear how long that might take. The US has participated indirectly in the talks because it withdrew from the accord in 2018. ",world
Suspect who killed 1 man in US grocery store shooting arrested,"A suspect who on Monday opened fire in a US grocery store in Washington state, killing one man, Justin Krumbah, 38, and critically injuring another victim has been arrested. Aaron Christopher Kelly, 39, was arrested by police 241 km from the shooting incident. A $1 million arrest warrant had initially been issued nationwide for the suspect.",world
"Cong promises 20 lakh jobs; electricity bills, farmers loans waiver in UP polls manifesto","Congress General Secretary Priyanka Gandhi Vadra on Wednesday launched the party's manifesto for the upcoming Uttar Pradesh Assembly polls. ""We will provide 20 lakh government jobs,"" she said. ""Farmers' loans will be waived off within 10 days of coming to power,"" she added. ""Electricity bills will be waived off, COVID-19-affected families will be given ₹25,000,"" Priyanka further said.",politics
"Rahul Gandhi misled, Channi not poor, his bank balance more than us: Sidhu's wife","Punjab Congress President Navjot Singh Sidhu's wife Navjot Kaur said that Rahul Gandhi was ""misled"" to consider CM Charanjit Singh Channi as poor. His bank balance is more than us, Kaur added. Notably, when Rahul declared Channi as Congress' CM candidate for Punjab polls, he had said the people of Punjab wanted a CM who comes from a poor family.",politics
I pray that sisters fighting for right to wear hijab are successful: Owaisi,"Amid the hijab controversy in Karnataka, AIMIM chief Asaduddin Owaisi said that he is praying that ""sisters fighting for their right to wear hijab are successful"". ""(A) grave violation of the Constitution's Article 15, 19 and 21 are being committed in Karnataka,"" he said in UP. Meanwhile, schools and colleges were shut in Karnataka for three days. ",politics
ED officials admitted their bosses asked to fix me: Raut to Venkaiah Naidu,"Shiv Sena MP Sanjay Raut wrote to Rajya Sabha Chairman and Vice President Venkaiah Naidu claiming that Enforcement Directorate (ED) and other investigating agency officials admitted that they have been ""asked by their bosses"" to ""fix"" him. Raut added that ED has been harassing him and his family after he refused to help ""certain people"" in toppling the Maharashtra government.",politics
5 remaining Congress MLAs in Meghalaya join BJP-backed MDA govt,"The remaining five Congress MLAs in Meghalaya on Tuesday joined the BJP-backed Meghalaya Democratic Alliance (MDA) government, led by CM Conrad Sangma. ""We were ditched and nobody took any action,"" said MLA Ampareen Lyngdoh. In November 2021, 12 Congress MLAs had joined TMC. Welcoming them, Sangma said, ""Joining of Congress MLAs won't affect the relationship with our coalition partners.""",politics
"Bikini, ghoonghat or hijab, it's woman's right to decide what she wants to wear: Priyanka ","Congress leader Priyanka Gandhi Vadra on Wednesday tweeted, ""Whether it is a bikini, a ghoonghat, a pair of jeans or a hijab, it is a woman's right to decide what she wants to wear."" She added, ""This right is guaranteed by the Indian constitution. Stop harassing women."" Notably, Karnataka High Court is hearing the issue of hijab ban in colleges.",politics
"Kangana should be respectful towards leaders, she's too harsh: Manoj Tiwari","Delhi BJP MP Manoj Tiwari said Kangana Ranaut should be ""respectful"" towards leaders even if she has issues with them. Speaking about her reaction against the Maharashtra government, Tiwari said, ""When she used to talk about Sushant (Singh Rajput), she was right. But...her attitude towards the Maharashtra government has been harsh. It's not correct...Criticise by all means, but with respect.""",politics
Writ petition in Calcutta HC seeks West Bengal Governor's removal,"A writ petition filed in the Calcutta High Court by Advocate Ramaprashad Sarkar seeks removal of West Bengal Governor Jagdeep Dhankhar from his position. The petition, which will be heard on February 11, said Dhankhar was interfering in Chief Minister Mamata Banerjee-led government's functioning. Banerjee recently also blocked Dhankhar on Twitter saying she was disturbed by the latter's posts.",politics
"Vote for SP, don't trust BJP's false promises: Mamata to UP voters ","Trinamool Congress chief Mamata Banerjee on Tuesday urged people to vote for the SP and defeat the BJP in the Uttar Pradesh elections. ""Don't fall for the false promises by the BJP,"" she said while addressing the media in Lucknow. ""History will never forgive those responsible for Hathras, Unnao incidents, and the bodies dumped in Ganga...during COVID-19,"" Banerjee added. ",politics
"Goa TMC seeks action against Shah, Priyanka for flouting COVID norms","The Trinamool Congress' Goa unit wrote to the Election Commission demanding strict action against Amit Shah, Priyanka Gandhi Vadra, Goa CM Pramod Sawant and many others for flouting COVID-19 norms during their poll campaign. In his letter, TMC MP Derek O'Brien alleged that the BJP leaders did not follow COVID-19 guidelines during their poll campaign in Sanvordem constituency.",politics
Those at responsible posts shouldn't indulge in rivalries: Kejriwal,"AAP National Convenor Arvind Kejriwal on Tuesday said leaders at responsible positions should not indulge in political rivalries. ""We, the political leaders...chosen by the people should not...put allegations on each other. We should work for the development of people,"" Kejriwal said. His remarks came after UP CM Yogi Adityanath accused him of forcing out migrants during the COVID-19 pandemic. ",politics
Does Centre know how many migrants died while walking back: Gehlot,"Rajasthan CM Ashok Gehlot on Tuesday termed Prime Minister Narendra Modi's comments saying Congress spread COVID-19 in India ""unfortunate"". Reacting to PM Modi's statement accusing Congress of giving free tickets to migrants to leave Maharashtra leading to COVID-19 spread in other states, Gehlot said, ""Do they have the figures of how many migrants who went back home on foot died?""",politics
BJP's plane of lies won't be able to land in UP this time: SP chief,"At a rally with West Bengal CM Mamata Banerjee, Samajwadi Party chief Akhilesh Yadav said, ""BJP's plane of lies won't be able to land in UP this time."" This comes after PM Narendra Modi's visit to Bijnor was cancelled citing bad weather. Yadav added that Banerjee could come from Kolkata to Lucknow but those from BJP couldn't come from Delhi.",politics
"BJP will lose in UP polls, people are tired of BJP's propaganda: Lalu","Rashtriya Janata Dal chief Lalu Prasad Yadav on Tuesday said that the Bharatiya Janata Party is going to lose in the upcoming Uttar Pradesh Assembly elections, which are scheduled to take place from February 10. He said that people in UP are tired of BJP's propaganda. ""They have only been talking about riots, religion and temple,"" the RJD chief added.",politics
2 former Tripura BJP MLAs join Cong ahead of 2023 Assembly polls ,"Former Tripura BJP MLAs Sudip Roy Barman and Ashish Kumar Saha joined the Congress on Tuesday after meeting Rahul Gandhi and Priyanka Gandhi Vadra in Delhi. ""Everyone is disillusioned with the party (BJP),"" Barman said. Saha and Barman had resigned from the BJP and their MLA posts on Monday ahead of the Tripura Assembly elections in 2023.",politics
Opp'n shouldn't use hijab controversy for political gains: Cong's Kharge,"Congress leader Mallikarjun Kharge on Wednesday said that the Karnataka government should resolve the hijab issue and Opposition parties should not use the controversy for political gains. ""If any student breaks discipline or does any work against the rules, then the government should discontinue the grants,"" Kharge added. ""Karnataka is a state with multi-culture practice,"" Kharge stated.",politics
Pushkar fire bhi hai flower bhi: Rajnath uses 'Pushpa' dialogue for U'khand CM,"Union Minister Rajnath Singh while addressing a rally in poll-bound Uttarakhand praised CM Pushkar Singh Dhami with a dialogue of movie 'Pushpa'. He said Congress is considering him as a flower going by his name but ""Apna Pushkar flower bhi hai aur fire bhi (Our Pushkar is flower and fire)."" Rajnath added that Pushkar Dhami won't stop or bow down.",politics
"Promise to make Uttarakhand ideal, developed state: Rajnath Singh","Defence Minister Rajnath Singh, while addressing a gathering in Uttarakhand's Gangolihat Assembly constituency, said that he is committed to making Uttarakhand an ""ideal and developed state"". Singh urged the people to cast their vote in favour of BJP and elect Pushkar Singh Dhami as Uttarakhand's Chief Minister, stating all necessary steps will be taken to make the state ""prosperous"".",politics
Priyanka Gandhi performs Yamuna Pooja in UP's Mathura; pics surface,"Ahead of upcoming Assembly elections in Uttar Pradesh, Congress General Secretary Priyanka Gandhi Vadra on Tuesday performed Yamuna Pooja at Vishram Ghat in Mathura. She held door-to-door campaign in UP's Hastinapur and Meerut districts today and also rode in a tractor during the rally. She said, ""Congress is receiving a good response from public during our campaigning for [UP]...elections.""",politics
"Don't fall for BJP's promises, make SP win: Mamata ahead of UP polls","West Bengal CM Mamata Banerjee, who's on a two-day visit to UP, on Tuesday asked people to support the Samajwadi Party in the upcoming state Assembly elections. She further asked people to defeat the BJP and not to fall for false promises made by BJP. She said this during a joint press conference with SP chief Akhilesh Yadav in Lucknow.",politics
Nehru let Goa suffer to protect his global image: PM Modi,"PM Narendra Modi said on Tuesday that ex-PM Jawaharlal Nehru let Goa remain under imperial rule for years because he ""was concerned about his international image"". ""Nehru thought that if Goa's foreign government was attacked, his image of a peace-loving global leader would have been harmed,"" PM Modi said while speaking on the motion of thanks to the President's address.",politics
Opposition daydreaming about division of votes in western UP: Modi,"Addressing a virtual rally for UP Assembly constituencies in Rampur, Badaun and Sambhal districts, PM Narendra Modi said that Opposition parties are daydreaming about the division of votes in western UP. However, the region's people will defeat them again as they did in the past, he added. PM Modi further said he didn't care about votes but about people's development.",politics
"Cong wiped out from whole country, only lurking in mountains: Rajnath Singh","Union Defence Minister Rajnath Singh on Tuesday said that the Congress party has been wiped out from the entire country. ""It (Congress) is only lurking in the mountains…BJP is an ideological party. Here prominence is given to ideology, not to individuality,"" Singh added. The Union Defence Minister was speaking at a public gathering in Uttarakhand.",politics
Bengal BJP writes to state EC seeking CAPF deployment for municipal polls,"West Bengal BJP unit wrote to the State Election Commissioner demanding immediate deployment of the Central Armed Police Forces (CAPF) for municipal polls in the state. ""There have been regular instances of our candidates being threatened (in the past)…We once again ask for the deployment of CAPF to remove the environment of fear,"" the state BJP wrote in the letter.",politics
Abuse Cong and Nehru but do your job: Rahul on PM Modi's RS speech,"Former Congress chief Rahul Gandhi responded to Prime Minister Narendra Modi's comments on Congress in the Rajya Sabha and said, ""Do abuse Congress and Nehru but do your job."" He added, ""My great grandfather served the country, I don't need anyone's certificate. BJP is scared of Congress as we say the truth."" ",politics
Which movies hold the record for the most wins in Oscar history?,"Three movies share the record for the most number of Oscar wins so far, according to trivia shared during the Oscar 2022 nominations announcement on Tuesday. 'Ben-Hur' (1959), 'Titanic' (1997) and 'The Lord of the Rings: The Return of the King' (2003) have each won 11 Oscar awards, sharing the record for the most Oscar wins by a film.",entertainment
"Sameera Reddy repeats her wedding saree after 8 years, shares pics","Sameera Reddy took to Instagram to share a collage which shows the actress wearing her wedding saree after 8 years. ""I wore my wedding saree after 8 years and it felt so amazing #wedding #feels,"" she wrote along with the collage. ""You look gorgeous! Then and now,"" one of the comments read.",entertainment
"Kangana Ranaut recalls gaining 20 kg for 'Thalaivii', shares throwback pic","Actress Kangana Ranaut took to Instagram Stories and recalled gaining 20 kg for 'Thalaivii', which released last year. Sharing a throwback picture, Kangana wrote, ""Throwback to Thalaivii days when I gained 20 kg for my role."" Last year, Kangana had revealed she has ""permanent stretch marks"" after gaining 20 kg in six months and losing it all within six months.",entertainment
"Actors Gurmeet Choudhary, Debina Bonnerjee expecting 1st child, share baby bump pic","TV actors Gurmeet Choudhary and his wife, actress Debina Bonnerjee, took to social media to share that they are expecting their first child. ""To Becoming 3. Choudhary junior coming soon. Seeking your blessings,"" they wrote while sharing a picture showing Debina's baby bump. Several celebrities, including Mouni Roy and Mahhi Vij, congratulated them in the comments section.",entertainment
Video shows Indian documentary makers' reaction after Oscar nomination,"Directors Rintu Thomas and Sushmit Ghosh jumped, screamed and hugged each other when their documentary 'Writing With Fire' was announced as an Oscar 2022 nominee, as seen in a video shared by Thomas on Twitter. It's one of the five nominees for the best documentary feature. It documents the story of Khabar Lahariya, a newspaper run by Dalit women journalists.",entertainment
My tears haven't stopped flowing ever since I heard Lata ji is no more: Mumtaz,"Speaking about late veteran singer Lata Mangeshkar, actress Mumtaz said her tears haven't stopped flowing ever since she has heard that Lata ji is no more. She added, ""To imagine cinema without her is beyond me. I'm proud to say she was my voice in all my best songs."" ""Now she's gone. There will never be another Lataji,"" Mumtaz said.",entertainment
I am open to the idea of a relationship: Varun Sharma,"Actor Varun Sharma has said he is open to the idea of a relationship. ""If I'm meant to connect with someone, it will happen,"" Varun said. ""There has to be mutual respect...In a relationship, you and your partner should be able to see and bear the extremeness of every emotion,"" he added.",entertainment
"I'm playing Indian Wonder Woman, to save world from COVID: Maheck on 'Naagin 6'","Actress Maheck Chahal said that she is playing the 'Indian Wonder Woman' in 'Naagin 6'. ""She is out there to save the world from coronavirus...It's a very positive character and I am super excited about it. The whole story has been changed this season...I am sure many girls would want to be in my shoes,"" Chahal said. ",entertainment
I'm an underdog in H'wood because I'm from the Bronx: Jennifer Lopez,"Singer-actress Jennifer Lopez said she is an ""underdog"" in Hollywood. ""I always feel like I was scraping from the bottom...That's part of being Puerto Rican...from the Bronx and a woman,"" Jennifer stated. ""Not being born into a family with money. Not knowing anybody in the business...I just went out there and said, 'F**k it. I'm going to...try',"" she added.",entertainment
"Sonu Sood like brother to me, no one better to host Roadies: Rannvijay","Actor Rannvijay Singha, who has been replaced as the host of youth-based reality show 'Roadies' by actor Sonu Sood, has said that the latter is like an elder brother to him. Rannvijay further said that there cannot be a better thing than Sonu hosting the show. ""We all have to understand change is inevitable and nobody is indispensable,"" he added.",entertainment
Annoying to see wrong Bengali words used in Hindi films: Sayani Gupta,"Discussing her thoughts on Bengali culture being integral in Hindi films being a Bengali herself, actress Sayani Gupta said Bengali culture has been celebrated, but it is ""annoying"" to see wrong Bengali words being used. ""Alta [red dye] is never put on the hands but only on the feet. In Hindi cinema, they tend to...run with it,"" added Sayani.",entertainment
"I've done more than 370 films, out of which I can't watch 200 films: Mithun","Actor Mithun Chakraborty said there was a time when he'd shoot multiple films simultaneously but today, he only does roles that ""tickle or pinch"" him. He added, ""I've done more than 370 films, out of which I can't watch 200 films."" ""Then there are some 150 films which did golden jubilee, diamond jubilee and ran for two years,"" Mithun said.",entertainment
"She called me bhaiya, I was numb after death news: Lata Mangeshkar's tailor","Taj Qureshi, tailor of late veteran singer Lata Mangeshkar, said she used to call him 'bhaiya'. ""I am nobody but she called me 'bhaiya', that made me feel so good...I feel proud she treated me like her brother...I got news of her death, I was shocked and numb. I couldn't process anything for at least two hours,"" Qureshi said.",entertainment
Tributes pour in for Jagjit Singh on his birth anniversary,"Fans and Bollywood personalities took to social media to pay tributes to ghazal singer Jagjit Singh on his birth anniversary on Tuesday. ""There can be no other like him,"" wrote singer Kavita Seth. Rajasthan Chief Minister Ashok Gehlot said, ""His (Jagjit Singh) melodious voice and soothing renditions continue to enthral his admirers. His contribution...shall always be remembered.""",entertainment
Couldn't watch 'Maine...' as I couldn't see mom sad: Avantika on Bhagyashree,"Actress Bhagyashree's daughter Avantika Dassani spoke about her mother's film, 'Maine Pyar Kiya' and said she had to watch it a couple of times to complete it. She added, ""When I first saw it, I couldn’t take it because I couldn't watch...mom being sad."" ""It wouldn't sit well with me. So, I would walk out of the room,"" Avantika said.",entertainment
Didn't have the courage to watch Lata didi's pyre being set on fire: Rahul,"Singer Rahul Vaidya recalls the moment when tricolour was lifted off Lata Mangeshkar's body to bid her the final goodbye. He said, ""When they lifted the tricolour, watching her body being kept on the 'chandan' wood pieces was a difficult moment...I choked."" ""I walked away even before they set her pyre on fire because I couldn't see that,"" he added.",entertainment
