news_headline,news_article,news_category
realme 9 Pro series set to launch in India on Feb 16,"realme announced that as India's first 5G smartphone brand, it's ready to launch realme 9 Pro Series in India on February 16, starting at ₹15,000, including first Pro+ model. It seeks to enable users to 'capture the light' with light shift design and flagship camera in mid-range segment. Counterpoint ranked realme second in Q4 2021 with market share of 17%.",technology
Bill Gates writes a book on how to make COVID-19 the last pandemic,"Microsoft Co-founder Bill Gates has written a book titled 'How to Prevent the Next Pandemic'. ""I believe COVID-19 can be the last pandemic and my book explains why,"" Gates said. ""Every time I read about the latest death toll or hear about someone who lost their job...I can't help but think: We don't have to do this again,"" he added.",technology
Ronaldo becomes the first-ever person to reach 400 mn followers on Instagram,"Manchester United forward Cristiano Ronaldo has become the first-ever person to have 400 million followers on Instagram. According to reports, the Portuguese footballer reached the milestone on February 6, just a day after his 37th birthday. In January 2020, he had hit 200 million followers on Instagram and celebrated the milestone by sharing a video montage of his pictures.",technology
Tesla cannot have a market in India but jobs in China: Govt,"Minister of Heavy Industries Krishan Pal Gurjar said there cannot be a situation where Tesla has a market in India but jobs are created in China. Stating that Tesla is yet to apply for schemes in India, he told the Lok Sabha, ""Our policy is if a company wants to use Indian market, it has to provide jobs to Indians.""",technology
"$3.6 bn in stolen Bitcoin seized in US' biggest-ever financial seizure, couple arrested","The US Department of Justice seized over $3.6 billion in stolen Bitcoin in its largest financial seizure ever and arrested a couple in relation to it. The husband-wife allegedly conspired to launder cryptocurrency stolen during the 2016 hack of Bitfinex, a virtual currency exchange, presently valued at $4.5 billion. A hacker attacked Bitfinex and initiated over 2,000 unauthorised transactions.",technology
Joe Biden acknowledges Tesla as 'US' largest electric vehicle maker'; Musk responds,"US President Joe Biden on Tuesday acknowledged Tesla as the country's ""largest electric vehicle manufacturer"", days after Elon Musk called him a ""damp sock puppet in human form"" for ignoring Tesla. A Twitter user said over 58,000 people signed a petition to ask Biden to ""acknowledge Tesla's EV leadership"". Responding to this, the billionaire said, ""Thanks, this made a difference!""",technology
Beggar hangs QR code around his neck to accept money using mobile wallet in Bihar,"Pictures and videos of a 40-year-old beggar, Raju Patel, using mobile wallets to accept money at Bettiah Railway Station in Bihar have gone viral on social media. Patel can be seen with a QR code of a mobile wallet around his neck. He said that he is inspired by Prime Minister Narendra Modi's Digital India campaign.",technology
"Woman orders Apple's iPhone 13 Pro Max in UK, gets ₹100 hand soap","A UK woman claimed that she received a package with a £1 (around ₹100) bottle of hand soap instead of the new iPhone 13 Pro Max smartphone she ordered online from Sky Mobile for over £1,500. She said Sky Mobile launched an investigation but more than a week on, she's still without a phone. ""It's definitely been stolen,"" she added.",technology
"Amazon more than doubles maximum base salary to $350,000 from $160,000 in US","Amazon is more than doubling the maximum base salary for its US-based technology and corporate employees to $350,000 from $160,000, according to a leaked internal memo seen by Bloomberg. ""This past year has seen a particularly competitive labour market,"" the memo said. Amazon also said it was increasing overall compensation ranges for most jobs globally.",technology
Don't make Instagram Kids app for kids under 13: Religious leaders to Zuckerberg,"Religious leaders including reverends and rabbis have written a letter to Meta CEO Mark Zuckerberg, saying, ""Cease all development of the newly proposed Instagram Kids platform for children under 13."" They said, ""Instagram Kids would prove disastrous for children's spiritual development."" Noting that the company has paused plans for the same, they added, ""Instagram Kids must end permanently.""",technology
"Facebook & Instagram block accounts of Army's Chinar Corps, no reason given: Officials","Facebook and Instagram have blocked the accounts of the Indian Army's Chinar Corps. It's over a week but the platforms haven't responded to the official communication in this regard, according to officials. According to an official, the accounts were created to negate the lies and propaganda flowing from across the border and to educate locals about Army's social welfare initiatives.",technology
Comfortable but damaging in long run: CRED Founder Kunal Shah on work from home,"CRED Founder Kunal Shah has said that work from home is comfortable but damaging in the long run. Shah tweeted, ""Impact of WFH on youth is the same as impact of children who study at home."" He added, ""No real bonds. No real social or network skills. Illusion of understanding and learning. No osmosis."" ",technology
"Paul McCartney's notes for 'Hey Jude' song sell as NFT for $76,800","An NFT (non-fungible token) of Paul McCartney's handwritten notes for The Beatles' hit song 'Hey Jude' has been auctioned for $76,800. McCartney wrote the song for Julian Lennon in 1968 to comfort him after his parents John and Cynthia Lennon's divorce. NFTs of an Afghan coat and a black cape worn by Lennon sold for $22,400 and $12,800, respectively.",technology
Tesla got subpoena related to Musk's 2018 tweet from US SEC in Nov,"The US SEC had issued a new subpoena to Tesla in November 2021 over CEO Elon Musk's 2018 tweet about taking the company private, filings revealed. It was issued on November 16, around 10 days after Musk asked his Twitter followers if he should sell 10% of Tesla stake. In 2018, Musk settled an SEC lawsuit over his tweet.",technology
5G network in final development stages in India: Ashwini Vaishnaw,"Communications, Electronics and IT Minister Ashwini Vaishnaw said on Tuesday that 5G network is in its final stages of development in India. ""The country has also developed its own indigenously developed 4G core and radio network...The country is participating today in development of 6G standards,"" Vaishnaw said. He further stated that India Semiconductor Mission has also been launched.",technology
US' NVIDIA abandons $40 bn purchase of UK-based ARM: Reports,"US-based NVIDIA is abandoning its $40 billion purchase of UK's ARM from SoftBank, media reports said citing sources. ARM will opt for an IPO instead of the sale, which would have been worth as much as $80 billion. ARM CEO Simon Segars has resigned, handing the job to President Rene Haas. The resignation is reportedly unrelated to the failed deal.
",technology
Crypto industry seeks revision of 30% tax on crypto transactions,India's cryptocurrency industry seeks to appeal to the Centre to revise the 30% tax on crypto transactions announced by Finance Minister Nirmala Sitharaman. The proposal is being headed by the Blockchain and Crypto Assets Council. WazirX Founder Nischal Shetty also endorsed an online petition on the same lines started by crypto education portal Crypto India's Co-founder Aditya Singh.,technology
Rogan offered $100 mn by Trump-affiliated site to leave Spotify,"Former US President Donald Trump-affiliated site Rumble has offered Joe Rogan $100 million over four years to leave Spotify after one of his podcasts on the platform has drawn a lot of criticism. The company tweeted at Rogan on Monday that it's ""ready to fight alongside"" him. Rogan had apologised after backlash against COVID-19 misinformation on his Spotify podcast.",technology
Apple acquires startup that uses AI for tailor-made music: Report,"Apple has acquired London-based AI Music, that uses artificial intelligence to generate tailor-made music, Bloomberg reported citing sources. The startup had about two dozen employees before the deal. Technology developed by AI Music can create soundtracks using royalty-free music and artificial intelligence to automatically ""shift"" songs based on certain conditions, time, among other things.",technology
70 religious leaders ask Zuckerberg to drop Instagram Kids plans,"Over 70 religious leaders have signed a letter asking Meta CEO Mark Zuckerberg to permanently stop the company's plan for an Instagram version aimed at young users. ""After much meditation and prayer, we assert that social media platforms that target immature brains...and are inspired by profit motives are not a tool for the greater good of children,"" the letter said.",technology
Apple unveils feature to let iPhones accept payments with a tap in US,Apple has unveiled 'Tap to Pay' feature that will allow businesses to accept credit and debit card payments directly on their iPhones with a tap on the device. The feature will not require any additional hardware or payment terminal and it will use near-field communication (NFC) technology. Stripe will be the first payment platform to offer the feature in US.,technology
Amazon's fired US worker's lawsuit alleging discrimination dismissed,"A US judge on Monday dismissed the discrimination lawsuit against Amazon by a fired employee Christian Smalls. The judge rejected Smalls' claim that he was fired because of being Black and opposing discriminatory COVID-19 policies. Amazon had fired Smalls in March 2020, saying he joined a protest at its warehouse on Staten Island despite being on paid quarantine.
",technology
Why is traditional media such relentless hatestream?: Elon Musk,"Tesla CEO Elon Musk in a tweet called the ""traditional media"" a ""relentless hatestream"". He said, ""Most news outlets attempt to answer the question: 'What are the worst things happening on Earth today?'"" He further said that it's hard to find out what is happening in the world without ""being bombarded with news that makes one sad and angry!""",technology
Get out before it eats up your soul: Singer Neil to Spotify staff,"Canadian-American singer-songwriter Neil Young has urged Spotify employees to ""get out of the place before it eats up your soul"". He criticised Spotify CEO and said, ""Daniel Ek is your big problem - not Joe Rogan. Ek pulls the strings."" Young recently pulled his music from Spotify in protest over allegedly misleading information on COVID-19 vaccines on Joe Rogan's podcast. ",technology
"Maha to offer Amazon, Swiggy incentives to electrify their fleets","Maharashtra will offer companies like Amazon, Uber, Swiggy and others, incentives to electrify their delivery fleets ahead of a 2025 target for cleaner air. ""We are trying to be on...earlier side of 2025 and see if companies can get certain more incentives and move sooner,"" state minister Aaditya Thackeray said. The state will be approaching some firms next month.
",technology
"India announce playing XI for 2nd ODI against West Indies, KL Rahul back","West Indies won the toss and elected to bowl first in the second ODI against India in Ahmedabad. West Indies captain Kieron Pollard is not featuring in the match due to a niggle, with Nicholas Pooran leading the side today. India have made one change to their playing XI, with KL Rahul replacing Ishan Kishan. ",sports
"Virat said 'Miyan, nobody will be able to forget what you did in Australia': Siraj","Fast bowler Mohammed Siraj, who finished as India's highest wicket-taker in the 2020-21 Test series against Australia, said that after returning from Australia, Virat Kohli told him, ""What you've done in Australia is unbelievable."" Siraj added, ""[Kohli further said] 'Miyan, nobody will be able to forget what you've done there. Keep at it.'""",sports
"₹5,625-crore Ahmedabad IPL team to be called 'Gujarat Titans'","The Ahmedabad franchise of the Indian Premier League will be called 'Gujarat Titans', the owners announced today. The team along with Lucknow Super Giants will make their debut in the IPL 2022. Gujarat Titans were bought by Irelia Company Pte Ltd (CVC Capital Partners) for ₹5,625 crore. The franchise is yet to unveil its logo.",sports
First bidding war of many in IPL auctions: Auctioneer on MS Dhoni's signing in 2008,"Recalling the 2008 IPL auction, auctioneer Richard Madley termed MS Dhoni's signing by CSK as the first bidding war of many in IPL. MS Dhoni was roped in by CSK for $1.5 million and MI were among the franchises who were part of the bidding war. Ex-CSK owner N Srinivasan had said he was clear at any price for Dhoni.",sports
Maybe I would have never played for India if I were an Indian: AB de Villiers,"Ex-South Africa cricketer AB de Villiers, while speaking on RCB podcast, said, ""Growing up in India would've been interesting."" ""Maybe I would've never played for India...It's tough to make it to the Indian team...you've to be a special player,"" he added. ""I think back on my career at RCB as the most amazing years of my life,"" said De Villiers.",sports
"Cummins breaks silence over Langer's exit, says 'We need a new style of coaching'","Australia Test captain Pat Cummins has broken his silence over controversy surrounding Justin Langer's resignation as head coach. Adding that Langer's coaching style was ""intense"", Cummins said players need a new style of coaching and skill set. Reacting to ex-cricketers criticising his silence, Cummins said, ""Just as you have always stuck up for your mates, I'm sticking up for mine.""",sports
"Referee gets hit on face with ice hockey stick during Beijing Olympics, video viral","A referee was unintentionally hit across her face with an ice hockey stick by a player during a match between the US and Canada at the Winter Olympics. A video of the incident has been widely circulated on social media. While blood gushed out of her injury, she returned to the rink to officiate the match after receiving medical help.",sports
Australia announce 18-member Test squad for historic tour of Pakistan,"Australia have announced their 18-member squad for their historic three-match Test series in Pakistan, which will begin on March 4 in Rawalpindi. It will be Australian men's cricket team's first visit to Pakistan in nearly 25 years. Mitchell Marsh, Josh Inglis and Mitchell Swepson have been included in the squad.",sports
Missed camera on Novak's face at Aus Open when Nadal won 21st Slam: Castle,"Referring to Rafael Nadal's record-breaking 21st Grand Slam singles title at Australian Open 2022, ex-British number one Andrew Castle said, ""Only camera we were missing...in Australia was...on Novak Djokovic's face on match point when Nadal made it to number 21."" The world number five moved past Roger Federer and Djokovic, who are both on 20 Grand Slams each.",sports
Leicester fan charged with assault for attacking Nottingham Forest players,"Nottinghamshire Police on Monday said a Leicester City fan was arrested and charged with multiple counts of assault after running onto the pitch and attacking Nottingham Forest players during their FA Cup match on Sunday. Cameron Toner, 19, attacked Forest players as they celebrated scoring their third goal in the game. Leicester condemned the attack, giving Toner a lifetime ban.",sports
"8 players including Anderson, Broad dropped from Eng Test squad for WI tour","England have dropped as many as eight players, including James Anderson and Stuart Broad, from their Test squad for their upcoming tour of West Indies. Apart from the pacers, Jos Buttler, Rory Burns, Haseeb Hameed, Dawid Malan, Sam Billings and Dom Bess have missed out. Uncapped pacers Saqib Mahmood and Matthew Fisher have been included in the 16-member squad. ",sports
"Had booster dose before coming to Russia, you should be proud: Kvitova","Talking about her COVID vaccination status after winning the first round in St Petersburg, two-time Wimbledon champion Petra Kvitova said tournament organisers should be ""proud"" of her for getting a booster dose of vaccine before coming to Russia. Sixth-seeded Kvitova beat unseeded Jule Niemeier of Germany 6-2, 6-1 at St Petersburg Ladies Trophy on Tuesday.",sports
Rafael Nadal to play Indian Wells Masters tournament in March,"21-time Grand Slam winner Rafael Nadal confirmed his participation in the ATP Masters 1000 tournament, BNP Paribas Open, also known as Indian Wells Masters. “The fans are really great and knowledgeable about tennis, and they really make me feel special when playing and everywhere I go,” he said. Nadal has won the tournament three times, his last win in 2013. ",sports
A strong message to team: Vaughan on Eng dropping 8 players for WI Tests,"Ex-England captain Michael Vaughan has said the selection for the Test squad for their upcoming tour of West Indies has sent a strong message to the team. Eight players from their Ashes squad, including James Anderson, Stuart Broad, have been dropped. ""Sometimes high-class senior bowlers can be an issue in the side...you sometimes need to move forward,"" Vaughan stated. ",sports
"Retained players form the base, we need more match-winners: DC's Saba Karim ","DC's Head of Talent Search Saba Karim has said they'll be looking for some match-winners in the upcoming IPL mega auction. ""[Our] retained players form the base...we need some more match-winners, who can fill up the vacant slots, and overall we can have a complete side,"" he stated. DC have retained Rishabh Pant, Axar Patel, Prithvi Shaw and Anrich Nortje.",sports
He'll definitely walk into the team for 2nd ODI: Karthik on KL Rahul,"Ahead of India-West Indies second ODI, veteran India wicketkeeper-batter Dinesh Karthik said KL Rahul will ""definitely"" be included in the squad after missing first ODI. ""If he does come in...I see him opening the innings,"" he added. India limited-overs vice-captain was reportedly not part of the first ODI due to a family engagement. Second ODI will be played on Wednesday.",sports
Germany’s Niklas Süle joins Borussia Dortmund from Bayern Munich,"Borussia Dortmund on Monday confirmed the signing of German international Niklas Süle from Bayern Munich. The defender joins Dortmund on a free transfer, as his contract with Bayern Munich expires at the end of the current season in June. Dortmund added Süle, 26, has signed a four-year contract with the club. Süle joined Bayern Munich in 2017 from Hoffenheim.",sports
Dhawan will get a decent amount: Ashwin ahead of IPL mega auction,"Ahead of IPL mega auction 2022, Ravichandran Ashwin said his ex-DC teammate Shikhar Dhawan will fetch a ""decent"" amount, adding he'll ""surely"" score 450-500 runs as well. ""So, you might ask who will need Dhawan? Except for RR, every single team will need Dhawan."" Notably, both Ashwin and Dhawan were released from DC. Dhawan was DC's leading-scorer in IPL 2021.",sports
Over 31 million Americans estimated to bet $7.6 billion on Super Bowl,"The American Gaming Association (AGA) on Tuesday said an estimated 31.5 million Americans will bet around $7.6 billion on the National Football League’s (NFL) championship game, Super Bowl LVI this Sunday. “Americans have never been more interested in legal sports wagering,” said AGA President and CEO Bill Miller. Thirty US states, plus Washington DC, offer legal betting.",sports
CSK should be ready to spend a lot more for Plessis: Ashwin on IPL auction,"Indian spinner Ravichandran Ashwin has said CSK should be ready to spend a lot more than they did last time if they want to retain Faf du Plessis for IPL 2022. ""Last time...CSK stole Plessis for ₹1.5 crore. But this time, I don't see that type of steal happening for him,"" he stated. Plessis scored 633 runs last season. ",sports
"Have been bowling regularly in the nets, always available: Suryakumar","Responding to a query about India's sixth bowling option, Suryakumar Yadav said he is ready to fill in as the bowling option, adding that he has been bowling regularly in the nets and is always available. ""I'm really flexible, wherever the team management wants me to bat. Really happy with the way things are going right now,"" stated Suryakumar.",sports
India Women suffer 18-run defeat against NZ in one-off T20I,India Women suffered an 18-run defeat against host New Zealand in the one-off T20I ahead of their five-match ODI series. The New Zealand openers Suzie Bates and Sophie Devine added 60 runs for the opening wicket to help their team post 155/5 in 20 overs. India's middle-order batter Sabbhineni Meghana top-scored for the team with her 37 off 30 balls.,sports
You have to be a special player to make it to Indian team: De Villiers,"Ex-South Africa wicketkeeper-batter AB de Villiers, who scored 20,014 runs in 420 international matches, said one needs to be a special player to make it to Indian team as it's tough. ""Obviously growing up in India would have been interesting. Maybe I would've never played for India,"" he added. De Villiers retired from all forms of cricket after IPL 2021.",sports
"Fans chant 'that's how your cat feels' after Zouma, who kicked cat, gets hurt","West Ham United defender Kurt Zouma, who was filmed kicking and slapping his cat across his kitchen floor, was booed by fans during their 1-0 win against Watford in Premier League. Fans also chanted 'that's how your cat feels' after the defender was hurt in a tackle and was seen limping on the field. Zouma has apologised over the incident.",sports
Pak announce squad for Australia Tests; Shaun Tait named fast bowling coach,"Pakistan Cricket Board (PCB) on Wednesday announced a 16-member squad for the upcoming historic home Test series against Australia, which will begin on March 4 in Rawalpindi. Haris Rauf, who's yet to make his Test debut, has been included in the squad along with Shan Masood. PCB has also named ex-Australia pacer Shaun Tait as the team's fast bowling coach. ",sports
"Half a million people have died since Omicron was detected, it's beyond tragic: WHO","WHO's incident manager Dr Abdirahman Mahamud said that everyone was saying Omicron COVID-19 variant is milder but ""half a million people have died since this was detected"". ""In the age of effective vaccines, half a million people dying, it's really something...It's beyond tragic,"" he added. Omicron makes ""previous peaks look almost flat"", Maria Van Kerkhove, WHO's COVID-19 Technical Lead, said.",world
"Referee gets hit on face with ice hockey stick during Beijing Olympics, video viral","A referee was unintentionally hit across her face with an ice hockey stick by a player during a match between the US and Canada at the Winter Olympics. A video of the incident has been widely circulated on social media. While blood gushed out of her injury, she returned to the rink to officiate the match after receiving medical help.",world
"Malala tweets on hijab ban in Karnataka college, says 'Stop marginalisation of Muslim women'","Nobel Peace Prize winner Malala Yousafzai on Tuesday tweeted on the issue of hijab ban in Karnataka college. She wrote, ""Refusing to let girls go to school in their hijabs is horrifying. Objectification of women persists - for wearing less or more."" She added, ""Indian leaders must stop the marginalisation of Muslim women.""",world
Kamala Harris' husband evacuated from school event after bomb threat,"US Vice President Kamala Harris' husband, Doug Emhoff, is safe after being evacuated from a high school in Washington DC on Tuesday by Secret Service agents following a bomb threat, his spokesperson said. The threat was made via a phone call, which authorities were tracing, police said. Emhoff was at Dunbar High School to help commemorate Black History Month. ",world
Putin agreed not to escalate Ukraine crisis: French Prez,"French President Emmanuel Macron on Tuesday said Russian President Vladimir Putin had told him that he would not further escalate the Ukraine crisis during their meeting in Moscow on Monday. Notably, Macron's announcement came after a Russian spokesman denied reports that Putin had assured the French President of not escalating the crisis. Macron met with the Ukrainian President on Tuesday.",world
Advisory issued for Indians in Canada and those travelling amid truckers' protest,"The High Commission of India in Ottawa has issued an advisory for Indian citizens in Canada and those who are planning to travel there to ""exercise a high degree of caution and remain alert"". This comes amid protests by truckers in Ottawa and other cities against COVID-19 vaccine mandates. Special helpline (6137443751) for distressed Indian citizens in Canada was released.",world
"Philippines logs over 3,500 new COVID-19 cases in last 24 hours","The Philippines' Department of Health reported 3,574 new daily COVID-19 cases on Tuesday. The officials added that the country recorded 83 deaths taking the total death toll to 54,621. Meanwhile, President Rodrigo Duterte urged residents to get vaccinated as the country is still not ""over the hump"". The Southeast Asian nation has so far reported over 36 lakh cases.",world
"Indonesia reports over 37,000 new COVID-19 cases in last 24 hours","Indonesian Health Ministry on Tuesday said the country reported 37,492 new daily COVID-19 cases in last 24 hours taking the total tally to over 45 lakh. The ministry added that 83 new deaths were recorded in the period. Meanwhile, Indonesia has administered over 32.5 crore COVID-19 vaccine doses including the booster dose since it started mass vaccinations in last January.",world
