news_headline,news_article,news_category
People said I played Tiger Memon exactly like him in 'Black Friday': Pavan,"As 'Black Friday' completed 15 years on Wednesday, actor Pavan Malhotra, who played Tiger Memon in the movie, said people told him that he portrayed Tiger exactly how he is. ""I hadn't met him and yet cracking the role the way I did, and people appreciating it even today is a big compliment for me,"" added Pavan.",entertainment
"Check out mini version of you, Deepika: Ranveer on girl imitating actress","Actor Ranveer Singh took to Twitter to share a video of a girl imitating wife and actress Deepika Padukone in scene from the film 'Ramleela'. ""No one like Leela! Check out this mini version of you! @deepikapadukone. Love the expressions!"" Ranveer wrote. Deepika and Ranveer had worked together in 'Ramleela' that released in 2013.",entertainment
Alka Yagnik visits Lata Mangeshkar's house to pay respects,"Singer Alka Yagnik on Tuesday visited late singer Lata Mangeshkar's house to pay her respects. ""I am devastated. This is personal grief for me,"" Alka had said on the day of Lata Mangeshkar's demise. ""May my dearest didi rest in eternal peace. I will be living the rest of my life with her voice,"" Alka had said. ",entertainment
I did nothing: Ekta on rumours Tejasswi won Bigg Boss 15 because of Naagin 6,"Reacting to trolls who accused actress Tejasswi Prakash of winning 'Bigg Boss 15' because of 'Naagin 6', producer Ekta Kapoor said, ""There was some kind of luck that went to her. More than that I've done nothing. I don't...have the power to tell...channel...I want this girl as my next Naagin."" She added, ""I connected to her when I saw her.""",entertainment
"Kangana should be respectful towards leaders, she's too harsh: Manoj Tiwari","Delhi BJP MP Manoj Tiwari said Kangana Ranaut should be ""respectful"" towards leaders even if she has issues with them. Speaking about her reaction against the Maharashtra government, Tiwari said, ""When she used to talk about Sushant (Singh Rajput), she was right. But...her attitude towards the Maharashtra government has been harsh. It's not correct...Criticise by all means, but with respect.""",entertainment
She sacrificed her marriage for her family: Shatrughan on Lata Mangeshkar,"Speaking about late veteran singer Lata Mangeshkar, veteran actor Shatrughan Sinha said that he admired her for what she did for her family. He added, ""Revered for every song that she sang. She sacrificed her marriage for her family. Well, that's what we have been told."" Shatrughan further said that the singer used to live her life in ""simplicity"".
",entertainment
"We have a Spider-Man group chat, always ends with 'Love you guys': Tom","Actor Tom Holland has revealed that he has a group chat with fellow Spider-Man actors Tobey Maguire and Andrew Garfield. He added that every now and then someone texts on the chat and they talk for an hour or two. ""And then it always ends with, 'Love you guys!' And we'll be off,"" the actor said.",entertainment
"I'm a spontaneous actor, don't like preparing too much: Karan Patel","Actor Karan Patel has said he is a spontaneous actor and doesn't like preparing too much for a character. ""To each his own, but I prefer getting into the scenes spontaneously unless it's a biopic or...where I have to be a certain person,"" he said. ""Getting totally engrossed in a character...it's not me,"" Karan added.",entertainment
"TVS Motor extends sustainability commitment, acquires SEMG","TVS Motor Company has announced the acquisition of a 75% stake in Swiss E-Mobility Group (SEMG). They believe that the acquisition reaffirms their commitment to expansion in Europe through leading brands. ""TVS Motor has always been committed to sustainability and has been investing in electric vehicles for over 10 years,"" TVS Motor Company Chairman, Venu Srinivasan, said.",automobile
Battery swapping policy announced for electric vehicles in Union Budget,"FM Nirmala Sitharaman during her Union Budget 2022-23 speech said, ""Considering the constraint of space in urban areas for electric vehicle charging stations at scale, a battery swapping policy will be launched."" She added, ""Inter-operability standards will be formulated."" Additionally, private sector will be encouraged to develop sustainable business models for 'Battery or Energy as a Service'.",automobile
"Elon Musk calls Biden a 'sock puppet', says he's treating Americans like 'fools'","World's richest person Elon Musk said Joe Biden is a ""damp sock puppet in human form"" after the US President left Tesla out of a discussion about electric vehicle production. ""Companies like General Motors and Ford are building more electric vehicles here at home than ever before,"" Biden said. In another tweet, Musk said, ""Biden is treating...American public like fools.""",automobile
31-yr-old man sues Uber for $63 million after he was left paralysed in a crash,"A 31-year-old man is suing Uber for $63 million in the US after his driver crashed into a parked car, leaving him a quadriplegic. The lawsuit said Uber should've never hired the driver, who had an ""alarming"" driving history, that included at least 20 citations. William Good is seeking a jury trial and damages for ""extraordinary suffering and permanent disability"".",automobile
"GM CEO takes her first driverless car ride in US, calls it surreal","General Motors CEO Mary Barra took her first fully autonomous car ride without a safety driver in San Francisco last week along with Cruise Co-Founder Kyle Vogt. Barra took the ride in a retrofitted Chevrolet Bolt EV, a part of Cruise's fleet of driverless vehicles. Barra called the ride ""surreal"" and ""incredible"" in a video posted by Cruise on YouTube.",automobile
Any hurt caused is regretted: Honda apologises on Pak dealer's post on Kashmir,"Honda Motor Company issued a statement over a social media post by the company's dealer in Pakistan that expressed solidarity with Kashmiri separatists. ""Honda is...committed towards ensuring compliance with laws and sentiments of every country it operates in. Any hurt caused to this effect is regretted,"" it said. Kia India, Toyota, Suzuki and Hyundai also apologised for posts on Kashmir.",automobile
"Hyundai, Kia recall 484,000 cars over fire risk, ask owners in US to park outside","Hyundai and its affiliate Kia have issued recalls for over 484,000 vehicles in the US over a potential fire risk in the engines and advised owners to park their cars outdoors and away from buildings. The companies said that an electrical component in their anti-lock brake systems could short circuit and cause a fire, even if the vehicles aren't running.",automobile
Deeply regret offence caused to people of India: Hyundai Motor on Pak distributor's tweet,"Hyundai Motor Company issued a statement, saying it ""deeply"" regrets the offence caused to people of India due to an ""unauthorised"" tweet from account named 'hyundaiPakistanOfficial' on Kashmir. ""We strongly reject the distributor's unauthorised non-business related social media activity,"" the South Korean auto major added. ""We've put in place processes to prevent a future recurrence,"" it said.",automobile
Regret hurt to sentiments: Suzuki Motor Corp on Pak dealerships' posts on Kashmir,"Suzuki Motor Corporation issued a statement saying that it ""deeply regrets the hurt to sentiments"" caused by ""insensitive communication"" in the social media posts made by the company's dealers in Pakistan. The posts in question had expressed solidarity with Kashmiri separatists. ""We don't align with any political or religious inclination in any part of the world,"" Suzuki Motor Corporation said.",automobile
"Mukesh Ambani buys ₹13cr Rolls-Royce SUV, one of India's most expensive cars: Report","Reliance Industries Chairman Mukesh Ambani has bought Rolls-Royce Cullinan costing ₹13.14 crore, one of India's most expensive cars, PTI reported quoting RTO officials. While base price of the car is said to be ₹6.95 crore, reports claimed that customised modifications substantially raised the SUV's price. A one-time tax of ₹20 lakh has reportedly been paid by RIL for the car.",automobile
"I understand, my firstborn died in my arms: Musk told father of Tesla crash victim","World's richest person Elon Musk emailed the father of a teen who died in a 2018 Tesla crash for weeks, court records show. Tesla CEO had asked James Riley if he'd like to talk, to which Riley said, ""There's nothing worse than losing a child."" ""I understand...My firstborn son died in my arms. I felt his last heartbeat,"" Musk responded.",automobile
Over $100 billion wiped off Tesla's market value in 1 day,"Tesla shares dropped by around 12% in a single day on Thursday, wiping out $109 billion off its valuation. This in shares came after Tesla announced its fourth-quarter earnings and near future outlook, with CEO Elon Musk stating that the company would not bring any new vehicles to market this year.",automobile
"Arjun Kapoor buys Ducati Scrambler worth ₹13 lakh, shares pics","Actor Arjun Kapoor on Sunday took to Instagram to share pictures of his ""new friend"" Ducati Scrambler which is worth ₹13 lakh. The actor shared a series of monochrome pictures of him posing with the bike, writing, ""I usually try & meet her over the weekend."" The Ducati India handle commented on the post, ""Glad you swiped right on her!""",automobile
India's largest electric vehicle charging station inaugurated in Gurugram,"India's largest electric vehicle (EV) charging station was inaugurated at Delhi-Jaipur National Highway in Gurugram on Friday. The new charging station, which's developed by tech-piloting company Alektrify, has a capacity of 100 charging points for four-wheelers and has 72 AC slow chargers and 24 DC fast chargers. Previously, the largest EV charging station of India's was situated in Navi Mumbai.",automobile
"Tesla recalls over 8,17,000 vehicles in US over seat belt reminder alert","Tesla is recalling over 8,17,000 vehicles in the US because an audible alert may not function when a vehicle starts and the driver has not buckled the seat belt, the National Highway Traffic Safety Administration said. It said Tesla's 2021-2022 Model S and Model X, 2017-2022 Model 3 and 2020-2022 Model Y do not comply with Occupant Crash Protection standards.",automobile
Self-charging hybrid cars outsell diesel cars 1st time in Europe: Report,"The European Automobile Manufacturers' Association has revealed that self-charging hybrid cars outsold diesel cars in Europe for the first time in 2021, by just 48 vehicles. One in 11 cars sold were battery-electric, totalling around 8,80,000 vehicles. A total of 19,01,239 million self-charging hybrid cars were registered in the EU, compared to 1.1 million registered in 2020.",automobile
"Tesla to recall nearly 54,000 vehicles that may disobey stop signs in US","Tesla will recall 53,822 US vehicles with the company's Full Self-Driving (Beta) software that may allow some models to conduct ""rolling stops"" and not come to a complete stop at some intersections. The National Highway Traffic Safety Administration said the recall covers some 2016-2022 Model S and Model X, 2017-2022 Model 3, and 2020-2022 Model Y vehicles.",automobile
"Tata Motors reports net loss of ₹1,516 cr in Q3, 4.5% drop in revenues","Tata Motors posted a consolidated net loss of ₹1,516.14 crore for Q3 FY22 as compared with profit after tax of ₹2,906.45 crore in Q3 FY21. It also reported a 4.5% YoY decline in consolidated revenues to ₹72,229 crore. Overall, the company posted a consolidated operating profit of ₹7,400 crore and a fall of 460 basis points in margin to 10.2%.",automobile
"Kia recalls 410,000 vehicles in the US over air bags risk","Kia is recalling more than 410,000 vehicles in the US to fix a problem that can stop the air bags from inflating in a crash. The recall covers certain Forte small cars, Sedona minivans and Soul small SUVs. While Kia said it has received 13 customer complaints and 947 warranty claims, it claimed no crashes or injuries have been reported.",automobile
Toyota remains world's biggest carmaker as it sells 10.5 mn vehicles in 2021,"Toyota Motor sold 10.5 million vehicles in 2021, making it the world's biggest carmaker for a second straight year. The company said that the vehicle sales included those by its affiliates Daihatsu Motors and Hino Motors. Volkswagen, which ranked second in the world in vehicle sales, delivered 8.9 million vehicles last year, marking its lowest sales figures in 10 years.",automobile
"Prioritise job creation, infra development: Mercedes-Benz India to govt","Mercedes-Benz India in its Budget recommendation asked the government to aim at long-term growth for the auto industry prioritising job creation, infrastructure development and introduction of latest technologies. ""With stable policies and a clear road map...an accelerated growth can be achieved transitioning the industry swiftly into...e-mobility era,"" Mercedes-Benz India MD Martin Schwenk said.",automobile
Renault-Nissan share plan to spend $26 billion on EVs in next 5 yrs,Renault and Nissan on Thursday shared detailed plans to spend $26 billion on electric vehicles over the next five years and said they will work more closely together to make electric cars. The companies also plan to increase the number of common platforms for EVs to five from four and build a combined EV line-up of 35 vehicles by 2030.,automobile
"Bosch India to invest over ₹1,000 cr in localisation of advanced auto tech","Auto components firm Bosch has said that it will invest over ₹1,000 crore in India for the localisation of advanced automotive technologies over the next five years and support the government's Atmanirbhar Bharat mission. Bosch, which completed its 100th year in the Indian market, also launched its mobility marketplace to provide its mobility-related assets under one platform.",automobile
Volvo Cars to invest $1.1 bn in Swedish plant to expand EVs production,"In a move to expand production of fully electric cars, Volvo Cars will invest 10 billion crowns ($1.1 billion) in its Torslanda manufacturing plant in Sweden in the next few years, the company said on Tuesday. Last week, Volvo and battery maker Northvolt announced to build a joint battery plant in Gothenburg with an investment of 30 billion crowns.",automobile
Ford to suspend or cut output at 8 factories due to chip shortage,"Ford Motor plans to suspend or cut production at eight of its factories in the United States, Mexico and Canada throughout next week due to chip shortage in the factories, a spokesperson told Reuters. Ford will also reduce shifts at its factories in Dearborn, Kentucky and Louisville and remove overtime at its Oakville factory in Canada, from February 7.",automobile
"How does FabiSpray, India's first COVID-19 nasal spray for treating adults, work?","Glenmark Pharma has launched India's first nasal spray for treating adult COVID-19 patients called FabiSpray. The nitric oxide nasal spray, which is sprayed over nasal mucosa, acts as a physical and chemical barrier against SARS-CoV-2, preventing it from incubating and spreading to the lungs. During its Phase 3 trials, the spray reduced viral load of 99% in 48 hours.",science
"Potentially dangerous giant asteroid to fly by Earth on March 4, captured in pic","An asteroid classified as 'potentially hazardous' by NASA will fly by the Earth on March 4 and it has been captured by the Virtual Telescope Project in Italy. The asteroid, estimated to be around 1.3 km in diameter, will come as close as 4.9 million km to the Earth. It was recently spotted by astronomer Gianluca Masi.",science
Construction machinery destroys several fossilised dinosaur prints in US,"Several scientists and palaeontologists have urged the US Bureau of Land Management to stop construction on a walkway at the Mill Canyon Dinosaur Tracksite in Utah, stating that some fossilised dinosaur footprints have been damaged by construction machinery. The Mill Canyon tracksite contains tracks from at least 10 dinosaur species, thought to have lived around 112 million years ago.",science
NASA signs $194 mn deal to build rocket to bring Mars samples back to Earth,"NASA has signed a contract of $194 million with Lockheed Martin's space division to build a ""small and lightweight rocket"" Mars Ascent Vehicle (MAV) that will return the first Mars rock samples to Earth. The MAV will be the first to take off from another planet. NASA's Perseverance Rover has been collecting samples from Mars since its landing in 2021. ",science
US startup Astra aborts NASA mission launch at the last second,"California-based rocket startup Astra aborted the liftoff of its first operational satellite launch, a NASA mission, on Monday, at the last second citing a technical glitch. The countdown was halted at T-minus zero, moments before Astra's two-stage Launch Vehicle 0008 was due to blast off. Astra's shares fell 14% on Monday following the call off.",science
German scientists to clone and breed pigs for human transplants,"German scientists have planned to clone and breed genetically modified pigs to serve as heart donors for humans. One of the researchers, Eckhard Wolf said the team aimed to have the new species modified from Auckland Island breed ready for transplant trials by 2025. In a first, a pig's heart was transplanted into a terminally-ill man in US last month.",science
" Antarctica's microbes may help in plastic clean-up, find scientists","Argentine scientists said a species of microbes found in Antarctica may help clean-up plastic waste on the continent. During their work at the Carlini base, researchers found the microbes consuming waste from fuel to create a cleaning system. Researchers stated that the microbes could help in plastic degradation since both fuel and plastic are polymers containing mainly carbon and hydrogen.",science
Toxins of sea anemone may be useful for life-saving drugs: Aus study,"Australian scientists said venom of sea anemone, Telmatactis stephensoni, may lead to life-saving drugs. Researcher Lauren Ashwood found that animal produced different venoms for different biological functions. Such toxins might be used for developing therapeutics for cardiovascular disorders, autoimmune diseases, Ashwood said. She added the toxin's purpose might shed light on its medical utility.",science
Megalodon may not have looked like great white shark: US study,"US researchers said Otodus Megalodon, world's largest shark that lived upto 3.6 million years ago, may not have looked like great white shark, as thought. In fact, scientists concluded all proposed forms of Megalodon remain just ""speculation"". Scientists compared fin, head and body shapes of five different shark species but found no patterns to determine Megalodon's body shape.",science
Research identifies brain region that helps control word pronunciation,"In a first, researchers at NYU's Grossman School of Medicine have identified the critical role of the dorsal precentral gyrus in maintaining control over speech and making sure people pronounce words as they intend to. This region that crosses the folded surface of the top of the brain is also known to help people process what they hear themselves saying.",science
Only 15% of world's coastal region remain intact from human activity: Study,"Research by University of Queensland (UQ) studied the impact of human activities on global coastal regions and found that only 15% of these areas remain intact and unharmed. The study also discovered that the areas containing seagrasses, savannah, and coral reefs were at the highest risk of human pressure threatening numerous species, habitats and economic security of people living there.",science
US to spend $1 billion to promote climate-friendly farming practices,"US Secretary of Agriculture, Tom Vilsack on Monday said the administration will invest $1 billion in pilot projects to promote farming, ranching and forestry practices that cut greenhouse gas emissions. As per Vilsack, projects would include capturing methane emissions on dairy farms or capture and store climate-warming carbon. Reportedly, the deadline to seek grants for these projects is April 8.",science
"NASA, SpaceX to review lagging in parachutes during last 2 missions ","Officials from NASA, SpaceX will investigate and review the lagging in parachutes which caused them to inflate over a minute later than planned during last two missions. We are taking extra caution with this very critical system, said NASA's Steve Stich. This comes as SpaceX's first private flight is set to launch from NASA's Kennedy Space Centre on March 30.",science
Experts to review water release plan for Fukushima plant: Japan govt,"Team of 15 experts from International Atomic Energy Agency (IAEA) will visit Japan's Fukushima nuclear plant from February 14-18 to review the water release plan, said Industry Ministry on Monday. Reportedly, over a million tons of treated radioactive water will be released into the sea to allow the plant's decades-long decommissioning. In 2011, a massive tsunami destroyed the plant partially.",science
World's glaciers contain less ice than thought: Study,"Researchers from France, USA revealed world's glaciers contain significantly less ice than previously thought. From 8 lakh pairs of images of glaciers taken from 2017-18, researchers said there is 20% less glacial ice present. The study also found that South America's Andean glaciers contain roughly 27% less ice, while those in Peru have lost 40% of their surface area.",science
"Mosquitoes are more attracted to red, orange and black colour: Study","Research by University of Washington found mosquitoes are more attracted to colours like red, orange, black and cyan. ""When they smell...CO2 from our breath, that scent stimulates the eyes to scan for specific colors...associated with a potential host, and head to them,"" professor Jeffrey Riffell said. Human skin regardless of its shade emits red-orange signal to their eyes, he added.",science
Japanese govt promotes smokeless technology to treat industrial waste,"Japanese government has been promoting an advanced smokeless incinerator to treat industrial waste in Hokkaido. The maker, Chuwa Industrial Corporation (CIC) said many such units are used across hospitals. Japan International Cooperation Agency (JICA) backed us to provide units to Morocco, Vietnam said CIC President. Reportedly, unit collects waste and incinerates it by pumping hot air inside it.",science
US study on monkeys finds Omicron specific booster may not be needed,"US government study on monkeys found no significant differences in protection offered by Moderna booster and an Omicron-specific booster against the virus, suggesting that an Omicron-specific shot may not be required. The study involved vaccinated monkeys with two doses of Moderna vaccine that were later dosed with either the conventional booster or the Omicron-specific one.",science
IIT Roorkee researchers find enzyme that breaks down plastic faster,"IIT Roorkee researchers found a three-dimensional structure of an enzyme from the microbe, Comamonas testosteroni KF1 that can help break down plastics faster, especially the non-biodegradable ones. Lead author Ravindra Kumar said the team identified all enzymes responsible for phthalate and teraphthalate degradation. Phthalate is a potential carcinogen used to increase plastics' durability.",science
Dubai to cut carbon emissions by 30% by 2030: Govt,"Dubai government's media office on Sunday said the emirate has planned to cut carbon emissions by 30% by 2030. The statement added that the plan is part of the UAE government's broader strategy to achieve carbon neutrality by 2050. Reportedly, the meeting reviewed the plans and roadmap to implement the strategy using the latest technologies.",science
"NASA's ELaNa 41 mission delayed, new launch on Feb 7: Astra","Astra Space Inc on Sunday said that the scheduled launch of NASA's Educational Launch of Nanosatellites (ELaNa 41) mission has been delayed after an unnamed range asset went out of service. The company added that the new launch is scheduled on February 7. Astra's Rocket 3.3 is set to carry four CubeSats, or small satellites, under the ELaNa 41 mission.",science
"In a first, chimpanzees filmed applying insects to each other's wounds","Chimpanzees in West Africa's Gabon were filmed for the first time while applying insects to their wounds and those of others that scientists believe must be a form of medical treatment. They also said that in the recording, these chimpanzees showed ""prosocial behaviour"" closely associated with human empathy which denotes actions that benefit other individuals in the group.",science
"88% marine species affected by severe plastic pollution, finds WWF","A report by World Wildlife Fund (WWF) said 88% of marine species are affected by severe contamination of plastic in the ocean. The report found that the fossil-fuel derived substance ""has reached every part of the ocean"". As per the report, at least 2,144 species suffer from plastic pollution with plastic content found in shellfish like blue mussels and oysters.",science
"In a first, electrode spinal implant helps 3 paralysed people walk again","In a first, a man with a complete cut to his spinal cord and two paralysed persons were able to walk again with a spinal implant. In the technique, researchers laid a soft, flexible electrode on top of their injured spinal cord. This system helped in electrically stimulating their spinal cord that restored their body movements by mimicking brain's actions.",science
