news_headline,news_article,news_category
Video shows mother throwing baby into dumpster in US; says 'Didn't know what to do',"An 18-year-old mother was caught on surveillance footage throwing her newborn baby alive into a dumpster in US' New Mexico. Alexis Avila told investigators she didn't know she was pregnant until January 6, when she sought medical attention because she was suffering from abdominal pain. She said she ""panicked and did not know what to do or who to call"".",world
Over 80 ostriches run through streets of China after escaping from farm,"Over 80 ostriches were seen running through the streets of Chongzuo in China after they escaped from a farm where the gates were not closed properly. Videos of the incident that surfaced on social media, showed the ostriches running in a pack in the streets. Later, the ostriches were safely returned to the farm with the help of the police. ",world
France sees biggest jump in COVID-19 hospitalisations since April,"The number of people in hospitals with COVID-19 in France rose by 767 to 22,749 on Monday, the biggest increase since April 2021. This comes amid rising coronavirus cases in France due to Omicron variant. Health Minister Olivier Veran said Omicron leads to less serious complications than other variants, but since it's highly infectious, it's pushing hospital numbers up quickly. ",world
"Mexican Prez tests COVID-19 +ve for 2nd time, says symptoms are 'mild'","Mexican President Andrés Manuel López Obrador said he has tested positive for coronavirus for the second time, but his symptoms are ""mild"". The 68-year-old, who rarely wears a face mask, got tested after he'd sounded hoarse at a Monday morning news briefing. ""I'll remain isolated and only work from the office and hold online meetings until further notice,"" he added. ",world
China halts some US flights after COVID-19 cases among arrivals,"China has ordered the cancellation of over two dozen scheduled flights from US in recent weeks after numerous passengers arriving in the country tested COVID-19 positive. A US-China air agreement allows the countries to operate over 100 weekly flights between the nations, but currently, only a fraction of those are operating. The US has reported over 6.1 crore COVID-19 cases.",world
We have enough vaccines for all Canadians to get 4th dose: Trudeau,Canadian PM Justin Trudeau said the government has secured enough COVID-19 vaccine doses for all eligible Canadians to receive a booster as well as a fourth dose. This comes as the country grapples with rising infection and hospitalisation rates due to the Omicron variant. More than 87% of Canadians aged 12 and older have received two COVID-19 vaccine doses.,world
Do not travel to Canada: US to citizens over COVID-19 surge,"The US on Monday advised its citizens to ""avoid travel"" to Canada because of a rising number of COVID-19 cases in the neighbouring country. Canadian health officials on Friday had said that new daily cases had soared by 65% in the previous week, threatening healthcare systems. Canada is facing a COVID-19 surge due to the highly transmissible Omicron variant. ",world
European Parliament President David Sassoli dies aged 65,"European Parliament President David Sassoli has died at the age of 65, his spokesman said. He was admitted to hospital in Italy last month due to a ""serious complication"" with his immune system. Sassoli left a three-decade career in journalism and became a member of the European Parliament in 2009. He was elected as the European Parliament President in 2019.",world
Iraq's new Parliament elects Speaker months after national election,"The new Parliament in Iraq elected Sunni lawmaker, Mohammed al-Halbousi as the Speaker on Sunday, three months after the national election. The incumbent speaker, Halbousi won after securing 200 votes in the 329-seat house defeating acting Speaker Mahmoud al-Mashahadani. This comes after the Parliament observed heated debates from parties over leadership of the house.",world
"Nearly 10,000 detained in Kazakhstan over violent protests","Nearly 10,000 people in Kazakhstan were detained by security forces during the violent anti-government protests last week, the Interior Ministry said. ""A substantial number of foreign nationals"" were among the detainees, officials said. Kazakhstan's President Kassym-Jomart Tokayev had said the protests, in which at least 164 people were killed, were instigated by ""terrorists"" with foreign backing.",world
Russian-led troops to start leaving Kazakhstan in 2 days: Prez,"Kazakhstan's President Qasym-Jomart Toqayev on Tuesday said a Russian-led military bloc will begin withdrawing its troops in two days after fulfilling its main mission of stabilising the Central Asian country after violent anti-government protests. ""The withdrawal process of the contingent will take no more than 10 days,"" he added. The troops were deployed last week at Toqayev's request. ",world
Philippines sees record high daily COVID-19 cases for 3rd straight day,"The Philippines reported 33,169 new COVID-19 cases on Monday, logging a record high caseload for the third straight day. The authorities added that 145 deaths were confirmed taking the death toll to over 50,000. However, the existing restrictions allowing restaurants, gyms to operate at 30% capacity will remain. The country reported 26,458 and 28,707 cases on Saturday and Sunday respectively.",world
Iran Foreign Minister to discuss cooperation agreement with China,"The Iranian Foreign Ministry said that the Foreign Minister, Hossein Amirabdollahian, will visit China by the end of this week to discuss the 25-year cooperation agreement along with various issues. The two countries signed the comprehensive strategic partnership agreement to strengthen their economic and political alliance in March 2021. This comes after both were subjected to US sanctions.",world
North Korea fires 2nd suspected missile in less than a week,"South Korea and Japan on Tuesday said North Korea has fired a ""suspected ballistic missile"", less than a week after it launched what it claimed was a hypersonic missile. South Korea's National Security Council held an emergency meeting and expressed ""strong regret"" over the test. The launch comes after six countries, including US, urged North Korea to end ""destabilising actions"". ",world
Sudan pro-democracy group rejects UN offer for talks with military,"Sudan's leading pro-democracy group, the Sudanese Professionals' Association (SPA) rejected UN's offer to mediate talks with the military. SPA said that the ""only way"" out of the ongoing crisis is through the removal of the generals from power. The group reiterated its demand for a fully civilian government. Sudan plunged into crisis after a military coup in October last year.",world
"Kazakhstan govt blames Islamic radicals for unrest, detains 8,000","Kazakhstan Foreign Ministry on Monday said that the country was subjected to armed aggression by radical Islamist groups. The ministry added that the government detained nearly 8,000 people to control the situation. This comes after government buildings and security forces were attacked last week after peaceful protests over fuel price hike turned into violent anti-government demonstrations.",world
Israel not bound by any nuclear deal with Iran: PM Naftali Bennett,"Israeli PM Naftali Bennett said on Monday that Israel isn't bound by any nuclear deal with Iran and is free to act without “constraints"" against Iran if necessary. PM Bennett’s comments come amid indirect talks between US and Iran to restart the stalled 2015 Iran nuclear deal. Israel had condemned this deal and views a nuclear-armed Iran as existential threat.",world
"72-year-old US man arrested for threatening to kidnap, kill Trump","A 72-year-old US man has been arrested and charged with allegedly threatening to kidnap and kill ex-President Donald Trump, a criminal indictment showed. Thomas Welnicki, who made a series of threats between July 2020 and December 2021, had at least once referred to Trump as ""Hitler"" and said he would do ""everything"" he can to make sure Trump was killed. ",world
"Shivakumar seen 'coughing' refuses COVID-19 test, says 'you can't force me'","Amid a surge in COVID-19 cases, Congress leader DK Shivakumar has refused to undergo a COVID-19 test. ""I am fit and fine. You can't compel me [to give my sample]...Tell your Home Minister I am perfect,"" Shivakumar said. This comes after Karnataka BJP on Sunday shared a video on Twitter purportedly showing Shivakumar coughing during a protest march in Karnataka.",politics
Making cheap comment on Saina shows ignoble mentality: Law Minister on Siddharth,"Union Law Minister Kiren Rijiju has said that making a cheap comment on an iconic personality like Saina Nehwal depicted a person's ""ignoble mentality"". Rijiju added India is proud of Saina for her outstanding contributions and she is a steadfast patriot besides being an Olympic medalist. This comes after actor Siddharth's ""Subtle cock champion of the world"" tweet targeting Nehwal.",politics
Saina demeaned for her political stand by so-called popular actor: Smriti Irani,"Union Minister Smriti Irani said badminton player Saina Nehwal was demeaned for her political position by a ""so-called popular actor"".  She added, ""Ms Nehwal had a point of view. But she was demeaned and objectified. Should such men be brought to justice?"" Actor Siddharth had tweeted ""Subtle cock champion of the world"" retweeting Nehwal's tweet on PM Modi's security breach.",politics
"PM Modi's picture, name excluded from vaccination certificates in 5 poll-bound states","The Health Ministry has removed PM Narendra Modi’s picture and name from the COVID-19 vaccination certificates being issued in the five poll-bound states. This is in accordance with the Model Code of Conduct coming into effect in Uttar Pradesh, Uttarakhand, Punjab, Goa and Manipur from Saturday. The elections will be held between February 10 and March 7 in seven phases. 
",politics
"Goa MLA Zantye quits BJP, says 'was sidelined after Parrikar's death'","Goa MLA Pravin Zantye on Monday quit the ruling BJP ahead of the state Assembly elections on February 14. The legislator from the Mayem seat said he was sidelined in the party after the death of former CM Manohar Parrikar. Earlier in the day, Goa Minister and BJP MLA Michael Lobo announced his resignation from his post and the party.",politics
Amarinder Singh's party gets hockey stick & ball as election symbol,"Former Punjab CM Captain Amarinder Singh's newly-launched party, Punjab Lok Congress, has been allotted a hockey stick and ball as an election symbol by the Election Commission. 
""Now all that is left is to score the goal,"" the party tweeted. Punjab will go to the polls on  February 14 and the results will be announced on March 10. ",politics
"Michael Lobo resigns as Goa minister, quits BJP ahead of polls","Goa minister and BJP MLA Michael Lobo on Monday announced that he's resigned from both his posts and has also quit from the party, ahead of the state Assembly polls scheduled for next month. ""Voters told me that...BJP is no more a party of the common people,"" he said. He added that he is ""in talks with other political parties"".",politics
Actor Sonu Sood's sister Malvika joins Congress ahead of Punjab elections,"Ahead of the Punjab Assembly elections, actor Sonu Sood’s sister Malvika Sood joined the Congress party in Moga on Monday. Several pictures of Punjab Congress chief Navjot Singh Sidhu meeting the actor and his sister surfaced on social media. In November, Sonu Sood had announced that his sister Malvika will join politics and would decide the political party soon.",politics
UP minister accused of inaugurating incomplete bridge before election code began,UP minister Suresh Kumar Khanna has been accused by the Samajwadi Party of inaugurating an incomplete bridge on the Garra river in a bid to take credit for it ahead of the upcoming Assembly elections. The SP also said the bridge was inaugurated days before the Model Code of Conduct came into force. The MCC came into effect on Saturday. ,politics
Can't wait to see her flourish: Sonu Sood wishes sister as she joins Congress,"Actor Sonu Sood's sister Malvika Sood on Monday joined the Congress party in Punjab. Taking to Twitter, he tweeted, ""As my sister, Malvika Sood embarks on her political journey, I...can't wait to see her flourish in this new chapter of her life."" Sonu added that his work as an actor and humanitarian will continue ""without any political affiliations or distractions"".",politics
"This election is between BJP's kaam, Congress' karnama: U'khand CM","Uttarakhand CM Pushkar Singh Dhami said on Monday, ""This election is between our kaam (work) and [Congress'] karnama (misdeeds)."" He added that BJP will publicise the development works done by his government in the upcoming Uttarakhand Assembly election. Dhami said that his party will follow all COVID-19 guidelines and that he is confident of winning the upcoming election.",politics
30 booked for COVID-19 violations during Cong's Mekedatu protest,"An FIR has been filed against 30 people for violating coronavirus protocols during Congress' protest seeking the implementation of the Mekedatu drinking water project, Karnataka Home Minister Araga Jnanendra said on Monday. He added that the Ramanagara district administration has taken the action as per law. ""We will not spare anybody who violates the law,"" he further added.",politics
Defence Minister Rajnath Singh recovering well from COVID: Official,"Defence Minister Rajnath Singh, who tested positive for COVID-19 on Monday, is recovering well, the principal spokesperson of the Defence Ministry said. He added that a team of doctors from the Army's Research and Referral Hospital in Delhi examined the Union Minister. Singh had tweeted that he had mild symptoms.",politics
BJP national president JP Nadda tests positive for COVID-19,"Bharatiya Janata Party (BJP) national president JP Nadda on Monday confirmed that he had tested positive for COVID-19. Taking to Twitter, he said, ""I am feeling fine and have isolated myself on the advice of doctors."" Several political leaders, including Defence Minister Rajnath Singh and Bihar CM Nitish Kumar, have tested positive for COVID-19 today.",politics
Can't give Hindus' money: VHP on Patnaik giving funds to Christian group,"After Odisha Chief Minister Naveen Patnaik sanctioned ₹79 lakh as assistance to the Missionaries of Charity from Chief Minister's Relief Fund, the Vishva Hindu Parishad has opposed the decision. VHP General Secretary Milind Parande said, ""Missionaries of Charity is involved in conversion."" He added that no Chief Minister has right to give money of Hindus to organisation that converts them.",politics
"Tharoor tweets word 'anocracy', says 'we'd better learn it in India'","Congress leader Shashi Tharoor on Sunday tweeted that people in India should ""better"" start learning the word ""anocracy"", in an apparent reference to government ahead of polls. He said that it means a ""form of government that mixes democratic with autocratic features"". ""[Such a government] permits elections, allows participation through opposition...but acts with minimal accountability,"" he added.",politics
BJP shares video of Shivakumar 'coughing' during protest in K'taka,"The Twitter handle of Karnataka BJP on Sunday shared a purported video of Congress leader DK Shivakumar coughing during Mekedatu dam protest with the hashtag ""#SuperSpreaderCONgress"". ""It appears that [Shivakumar] is having COVID-19 symptoms but is still interacting with Congress workers without a mask,"" the party alleged. It further questioned, ""Is he hell bent on increasing [COVID-19] cases?""",politics
Mayawati urges EC to curb rising use of religion during elections,"BSP chief Mayawati on Sunday expressed concern over the ""increasing"" use of religion during elections and urged Election Commission (EC) to ""take serious steps to curb the narrow politics of selfishness"". This comes after Uttar Pradesh CM Yogi Adityanath said that upcoming state Assembly elections will be ""80% versus 20%"", alluding to the about 20% Muslim population in the state.",politics
Sidhu launches digital campaign ahead of Punjab Assembly polls,"Punjab Congress chief Navjot Singh Sidhu on Sunday launched the party's digital campaign ahead of the Assembly elections. Emphasising the need for ""Digital Punjab"", Sidhu said, ""Our social media war room...has [over] 10,000 WhatsApp groups...we are reaching to people...via...digital means.” Speaking about the 'Punjab Model', Sidhu said it is a tailor-made solution for issues prevalent in state.",politics
"Digvijaya compares RSS to 'termites', says it works 'discreetly'","Congress leader Digvijaya Singh on Monday used the ""termite"" analogy to criticise RSS, saying that like termites silently damage houses, similarly RSS works ""discreetly and damages the entire system"". He clarified that he wasn't calling RSS a termite, but the ""character of the ideology"". He added that a false narrative is being created that Hinduism is in danger.",politics
Called Punjab CM due to concern over PM's security lapse: Priyanka,"Congress' Priyanka Gandhi Vadra has said that she called Punjab CM Charanjit Singh Channi after PM Narendra Modi's security breach on January 5 out of concern. ""I have no constitutional post...I was worried about the PM...I [spoke] to Channi ji as a colleague only,” Priyanka said. PM Narendra Modi is 'desh ke pradhamantri', (country's prime minister) she added.",politics
Section 144 imposed in Chamoli district ahead of Uttarakhand polls,"Ahead of Uttarakhand Assembly elections, Section 144 has been imposed from January 8 in Chamoli district to conduct the polls in a peaceful manner, said Chamoli DM Himanshu Khurana. Dehradun DM has also imposed Section 144 in the district, however, the order is not applicable on door-to-door visits of poll candidates. Uttarakhand elections are scheduled for February 14.",politics
BJP fully prepared for digital rallies in U'khand: Union Minister,"Union Minister Ajay Bhatt has said that BJP is fully prepared for digital rallies in Uttarakhand after Election Commission barred physical rallies in poll-bound states till January 15 amid rising COVID-19 infections. ""We'll try to connect with the areas [having] low connectivity in small groups,"" he said. Uttarakhand will witness single-phase polling for Assembly elections on February 14.",politics
Mayawati will not contest upcoming UP Assembly polls: BSP MP Misra,"Bahujan Samaj Party (BSP) chief and former Uttar Pradesh CM Mayawati will not contest the upcoming state Assembly elections, party MP Satish Chandra Misra said on Tuesday. He added that he will also not be contesting the polls. Furthermore, Misra criticised Samajwadi Party (SP) saying, ""If SP does not have 400 candidates, how will they win 400 seats?"" ",politics
No alliance with AAP for Punjab polls: Sanyukt Samaj Morcha,"Sanyukt Samaj Morcha (SSM) leader Balbir Singh Rajewal has ruled out an alliance with Aam Aadmi Party (AAP) for the upcoming Punjab Assembly elections. While speaking to media, Rajewal said that all SSM candidates for the elections will be declared in a week. He also termed suggestions of SSM seeking 60 seats while AAP only offered ten seats as ""baseless"".",politics
Saina demeaned for her political stand by so-called popular actor: Smriti Irani,"Union Minister Smriti Irani said badminton player Saina Nehwal was demeaned for her political position by a ""so-called popular actor"".  She added, ""Ms Nehwal had a point of view. But she was demeaned and objectified. Should such men be brought to justice?"" Actor Siddharth had tweeted ""Subtle cock champion of the world"" retweeting Nehwal's tweet on PM Modi's security breach.",entertainment
"24-year-old fake casting director seeks sexual favours from actress for role, arrested","A 24-year-old man was arrested after he allegedly posed as casting director and demanded sexual favours from a woman, who claims to have acted in Bengali films, promising her role in web series, a Mumbai police official said. The accused, Omprakash Tiwari, earlier worked with a production house. ""He...asked her [for]...private photos...Tiwari [then] started to threaten her,"" the official added.",entertainment
Veteran singer Lata Mangeshkar in ICU after testing COVID-19 positive,"Veteran singer Lata Mangeshkar was admitted to a hospital in Mumbai on Tuesday after she tested positive for COVID-19. The 92-year-old is currently undergoing treatment at the intensive care unit (ICU) of Mumbai's Breach Candy hospital. ""She has mild symptoms. She has been kept in ICU only for precautionary reasons considering her age,"" her niece confirmed to news agency ANI.",entertainment
Ayushmann Khurrana buys apartment in Mumbai for ₹19 crore: Reports,"Actor Ayushmann Khurrana has bought an apartment in Mumbai's Andheri West for around ₹19 crore, Moneycontrol reported. The total size of the apartment is 4,027 sq ft and it comes with parking for four cars, reports added. Ayushmann's brother Aparshakti Khurana also bought a property in the same housing complex for ₹7 crore, reports further stated.",entertainment
Making cheap comment on Saina shows ignoble mentality: Law Minister on Siddharth,"Union Law Minister Kiren Rijiju has said that making a cheap comment on an iconic personality like Saina Nehwal depicted a person's ""ignoble mentality"". Rijiju added India is proud of Saina for her outstanding contributions and she is a steadfast patriot besides being an Olympic medalist. This comes after actor Siddharth's ""Subtle cock champion of the world"" tweet targeting Nehwal.",entertainment
"My daughter has won medals for India, what has he done? Nehwal's father on Siddharth","Reacting to actor Siddharth's alleged lewd tweet about Saina Nehwal, the badminton player's father Harvir said, ""My daughter has won medals, brought laurels for India. What has he done for the country?"" ""I felt very bad when he used such words for my daughter,"" he further said. Harvir further demanded an apology from the actor.",entertainment
There is superstardom and then there’s SRK: Tahir Raj Bhasin,"Talking about Shah Rukh Khan trivia being included in his upcoming series 'Yeh Kaali Kaali Ankhein', actor Tahir Raj Bhasin said Shah Rukh Khan's legacy is greater than that of a superstar. ""There is superstardom and then there's Shah Rukh Khan. He...[represents] an institution of someone who has a dream and puts in everything to make it,"" said Tahir.",entertainment
'Baahubali' actor Sathyaraj discharged from hospital ,"Veteran actor Sathyaraj, who was hospitalised after contracting COVID-19, has been discharged. The 'Baahubali' actor's son Sibi Sathyaraj confirmed on Tuesday that the 67-year-old actor is back home. ""He's totally fine and will resume work after [a] few days of rest. Thank you all for your love and support,"" Sibi wrote on Twitter. 
",entertainment
Rajkummar wants to earn Oscar nomination for my biopic: Srikanth Bolla,"Discussing an interaction with Rajkummar Rao who will be portraying the lead role in visually-impaired industrialist Srikanth Bolla's biopic, Bolla said Rajkummar wants to deliver a career-best performance and earn the film an Oscar nomination. ""He is...inspired after hearing my...story. [Rajkummar] will be coming to Hyderabad to live with me for understanding my life...better,"" added Bolla.",entertainment
"Man dressed as Spider-Man dances on 'Saami Saami', Allu Sirish shares video","Allu Arjun's brother and actor Allu Sirish took to Twitter to share a video of a man dressed as Spider-Man recreating Rashmika Mandanna's steps on song 'Saami Saami' from film 'Pushpa: The Rise'. ""Spider-Man celebrating his success dancing to 'Rara Saami' from 'Pushpa'! As a fan of AA and Spidey...Waah! This is India boss. @SpiderMan good job buddy,"" Sirish wrote. ",entertainment
Can't wait to see her flourish: Sonu Sood wishes sister as she joins Congress,"Actor Sonu Sood's sister Malvika Sood on Monday joined the Congress party in Punjab. Taking to Twitter, he tweeted, ""As my sister, Malvika Sood embarks on her political journey, I...can't wait to see her flourish in this new chapter of her life."" Sonu added that his work as an actor and humanitarian will continue ""without any political affiliations or distractions"".",entertainment
Countless memories: Yami shares pic from 'Uri' set as film completes 3 yrs,"
Marking the third anniversary of her film 'Uri: The Surgical Strike' on Tuesday, actress Yami Gautam shared an old picture from the sets of the Aditya Dhar directorial and wrote, ""Countless memories and profound gratitude."" The film, based on the Indian Army's surgical strikes in Pakistan-occupied Kashmir following the Uri terror attack, also featured Vicky Kaushal and Paresh Rawal. ",entertainment
Always a blessing: Ananya Panday on working with Deepika Padukone,"Having worked with Deepika Padukone in their upcoming movie 'Gehraiyaan', actress Ananya Panday said it is always a blessing to work with actors like Deepika who deliver stronger performances. ""It's always a blessing to have stronger performances opposite you to feed. If I've learned anything [from Deepika], it's that acting is a lot of reacting,"" added Ananya.",entertainment
Ajay & Alia were paid full amounts of ₹35 cr & ₹9 cr for cameos in RRR: Reports,"Actors Ajay Devgn and Alia Bhatt, who'll make cameos in SS Rajamouli's 'RRR', have reportedly been paid their market price. According to reports, Alia has less than twenty minutes of playing time but has been paid ₹9 crore for her brief role. Meanwhile, Ajay, who'll make a guest appearance in the film has been paid ₹35 crore, reports added.",entertainment
